{
  "$schema": "https://json-schema.org/draft/2020-12/schema",
  "$id": "nara.reference-game.release-trusted-input-v1",
  "title": "Nara Reference-Game Release Trusted Input",
  "type": "object",
  "additionalProperties": false,
  "required": [
    "schema",
    "format_version",
    "now_unix_seconds",
    "approval",
    "repository",
    "publisher",
    "tag",
    "candidates"
  ],
  "properties": {
    "schema": {
      "const": "nara.reference-game.release-trusted-input-v1"
    },
    "format_version": {
      "const": 1
    },
    "now_unix_seconds": {
      "type": "integer"
    },
    "approval": {
      "type": "object"
    },
    "repository": {
      "type": "object"
    },
    "publisher": {
      "type": "object"
    },
    "tag": {
      "type": "object"
    },
    "candidates": {
      "type": "array",
      "minItems": 2,
      "maxItems": 2
    }
  }
}
